ORGNAME,INGROUP,ALIAS,GATK_FIRST_MONTH,GATK_FIRST_DAY,GATK_FIRST_YEAR,GATK_LAST_MONTH,GATK_LAST_DAY,GATK_LAST_YEAR,USATK_FIRST_MONTH,USATK_FIRST_DAY,USATK_FIRST_YEAR,USATK_LAST_MONTH,USATK_LAST_DAY,USATK_LAST_YEAR,LOC_HQ_COUNTRY_1,LOC_USATK_STATE_1,HIS ,HIS_CLEAN,DFORM_MONTH,DFORM_DAY,DFORM_YEAR,PHIL,PHIL_CLEAN,DOM_I,SPLINTER ,ALLIED  ,ORGSIZE,ENVIRONMENTAL,LEFT_WING,RIGHT_WING,RIGHT_WING_SOVEREIGN,RIGHT_WING_ANTIGOV,RELIGIOUS,RELIGIOUS_CHRISTIAN,RELIGIOUS_JEWISH,RELIGIOUS_MUSLIM,RELIGIOUS_ SHIA,RELIGIOUS_ SUNNI,NATIONALIST_SEPARATIST,SINGLE_ISSUE,,,,,,,,,,,,,,,,,,,,,,,,,,,,,,,,,,,,,,,,,,,,,,,,,,,,,,,,,,,,,,,,,,,,,,,,,,,,,,,,,,,,,,,,,,,,,,,,,,,,,,,Cuban Action,3581,Accion Cubana; Cuban Power,5,16,1970,8,13,1975,5,16,1970,7,18,1975,-99,34,"The Cuban Action was formed in December 1967 by Orlando Bosch Avila and was active from the late 1960s to the mid-1970s.  Motivated by hatred for the Castro regime and its policies, Avila tasked his group with damaging Cuban interests and punishing other governments, such as Panama, Colombia and Mexico, that did business with Castro. Realizing that multilateral cooperation on attacks and resources was more beneficial than unilateral action, Avila formed an umbrella organization (the Coordination of the United Revolutionary Organization) in the mid-1970s, which networked the Cuban Action to four other anti-Castro groups. While the Cuban Action was active under the CORU umbrella, the group eventually disbanded in the mid- to late-1970s as a result of Avila's departure and subsequent incarceration in Venezuela. ","The Cuban Action was formed in December 1967  and was active from the late 1960s to the mid-1970s.  Motivated by hatred for the Castro regime and its policies, the group's founder tasked Cuban Action with damaging Cuban interests and punishing other governments, such as Panama, Colombia and Mexico, that did business with Castro. Realizing that multilateral cooperation on attacks and resources was more beneficial than unilateral action, he formed an umbrella organization (the Coordination of the United Revolutionary Organization) in the mid-1970s, which networked the Cuban Action to four other anti-Castro groups. While the Cuban Action was active under the CORU umbrella, the group eventually disbanded in the mid- to late-1970s as a result of the leader's departure and subsequent incarceration in Venezuela. ",12,-99,1967,"The Cuban Action was a militant right-wing, anti-Castro group that went underground to “direct the internationalization of the war against Castro” and the interests of her allies. On other occasions, the Cuban Action attacked and kidnapped representatives of states that jailed group members, believing that such tactics would earn them the release of their imprisoned comrades. ","The Cuban Action was a militant right-wing, anti-Castro group that went underground to “direct the internationalization of the war against Castro” and the interests of her allies. On other occasions, the Cuban Action attacked and kidnapped representatives of states that jailed group members, believing that such tactics would earn them the release of their imprisoned comrades. ",5,Coordination of the United Revolutionary Organization,Cuban National Liberation Front; Bay of Pigs Veterans' Association;  the National Cuban Movement,0,0,0,0,0,0,0,0,0,0,0,0,0,1,,,,,,,,,,,,,,,,,,,,,,,,,,,,,,,,,,,,,,,,,,,,,,,,,,,,,,,,,,,,,,,,,,,,,,,,,,,,,,,,,,,,,,,,,,,,,,,,,,,,,,,Cuban C-4 Movement,3927,,11,9,1974,11,9,1974,11,9,1974,11,9,1974,-99,9,There is no available information on the group's historical context.,There is no available information on the group's historical context.,-99,-99,-99,"While there is little information available on the group, they did state after their attack in Canada that they were anti-Castro.","While there is little information available on the group, they did state after their attack in Canada that they were anti-Castro.",5,,,-99,0,0,0,0,0,0,0,0,0,0,0,0,1,,,,,,,,,,,,,,,,,,,,,,,,,,,,,,,,,,,,,,,,,,,,,,,,,,,,,,,,,,,,,,,,,,,,,,,,,,,,,,,,,,,,,,,,,,,,,,,,,,,,,,,Cuban Secret Army,100045,,9,30,1976,9,30,1976,9,30,1976,9,30,1976,-99,34,There is no available information on the group's historical context.,There is no available information on the group's historical context.,-99,-99,-99,No information is available on the group's philosophy.,No information is available on the group's philosophy.,-99,,,-99,0,0,0,0,0,0,0,0,0,0,0,0,0,,,,,,,,,,,,,,,,,,,,,,,,,,,,,,,,,,,,,,,,,,,,,,,,,,,,,,,,,,,,,,,,,,,,,,,,,,,,,,,,,,,,,,,,,,,,,,,,,,,,,,,Earth First!,10057,Monkey Wrench Gang; EF!ers,1,29,1989,7,31,1994,1,29,1989,7,31,1994,217,5,"Earth First! was founded in 1980 by David Foreman with the help of Mike Roselle, Bart Koehler, Howie Wolke and Ron Kezar. According to Foreman, ""the main reason for Earth First! is to create a broader spectrum within the environmental community…The people who started Earth First! felt there was a need for a radical wing to the environmental movement” [13, p. 58].  Earth First! advocated for “limiting the size of major cities, reclaiming wilderness areas lost to development, and tearing down dams” [13, p.63]. While most of their environmentalist activities were legal and non-violent, tree spiking incidents, the destruction of lumber equipment and arsons were claimed under the banner of Earth First!. According to its website, over the past two decades Earth First! has grown into “an international movement, composed of small bio-regionally based groups” with members ranging from “animal rights vegans to wilderness hunting guides, from monkeywrenchers to careful followers of Gandhi, from whiskey-drinking backwoods riffraff to thoughtful philosophers, from misanthropes to humanists.”In the late 1980s and early '90s, new groups began to splinter from Earth First! after internal strife mounted. For instance, Foreman founded the Evan Mecham Eco-Terrorist International Conspiracy in 1987, and the Earth Liberation Front (ELF) was founded in 1992. Despite internal factions, Earth First! still exists to this day, advocating the tenets of deep ecology and publishing in the Earth First! Journal articles in opposition to U.S., British and Australian government and corporate policies that produce negative externalities in the environment.","Earth First! was founded in 1980. According to one of the founders, ""the main reason for Earth First! is to create a broader spectrum within the environmental community…The people who started Earth First! felt there was a need for a radical wing to the environmental movement” [13, p. 58].  Earth First! advocated for “limiting the size of major cities, reclaiming wilderness areas lost to development, and tearing down dams” [13, p.63]. While most of their environmentalist activities were legal and non-violent, tree spiking incidents, the destruction of lumber equipment and arsons were claimed under the banner of Earth First!. According to its website, over the past two decades Earth First! has grown into “an international movement, composed of small bio-regionally based groups” with members ranging from “animal rights vegans to wilderness hunting guides, from monkeywrenchers to careful followers of Gandhi, from whiskey-drinking backwoods riffraff to thoughtful philosophers, from misanthropes to humanists.”In the late 1980s and early '90s, new groups began to splinter from Earth First! after internal strife mounted. For instance, one of the group's founders founded the Evan Mecham Eco-Terrorist International Conspiracy in 1987, and the Earth Liberation Front (ELF) was founded in 1992. Despite internal factions, Earth First! still exists to this day, advocating the tenets of deep ecology and publishing in the Earth First! Journal articles in opposition to U.S., British and Australian government and corporate policies that produce negative externalities in the environment",4,-99,1980,"Earth First! is committed to the philosophy of “deep ecology” and biocentrism, believing that entire ecosystems should be cherished and respected as much as (if not more than) human life. Earth First! was established to act as “an environmental gadfly” [12 p. 15] and criticized other environmental groups for not taking a stronger stand in defense of the environment. One founder, David Foreman preached the high value of action, encouraging members and supporters to “let action set the finer points of [one's] philosophy” [12, p. 15].  Beyond its call for action, Earth First! espoused a form of so-called “thoughtful radicalism,” whereby members would benignly thwart, protect and restore the environment while also educating people about the harmful ecological consequences of some government and corporate polices.Edward Abbey's The Monkey Wrench Gang (1975), which tells a story of “radical Southwestern environmentalists who burned billboards, sabotaged bulldozers and planned to blow up dams” [10], was adopted as the movement's key blueprint and organizational guide.   By the mid-1980s, Foreman's Eco-defense: A Field Guide to Monkeywrenching became the seminal informative text in the environmental movement, teaching members how to decommission bulldozers, ground helicopters and  make the most of tree sitting operations.","Earth First! is committed to the philosophy of “deep ecology” and biocentrism, believing that entire ecosystems should be cherished and respected as much as (if not more than) human life. Earth First! was established to act as “an environmental gadfly” [12 p. 15] and criticized other environmental groups for not taking a stronger stand in defense of the environment. One founder preached the high value of action, encouraging members and supporters to “let action set the finer points of [one's] philosophy” [12, p. 15].  Beyond its call for action, Earth First! espoused a form of so-called “thoughtful radicalism,” whereby members would benignly thwart, protect and restore the environment while also educating people about the harmful ecological consequences of some government and corporate polices.The Monkey Wrench Gang (1975), which tells a story of “radical Southwestern environmentalists who burned billboards, sabotaged bulldozers and planned to blow up dams” [10], was adopted as the movement's key blueprint and organizational guide.   By the mid-1980s, Eco-defense: A Field Guide to Monkeywrenching became the seminal informative text in the environmental movement, teaching members how to decommission bulldozers, ground helicopters and  make the most of tree sitting operations.",5,Earth Liberation Front; Evan Mecham Eco-Terrorist International Conspiracy (EMETIC).,,-99,1,0,0,0,0,0,0,0,0,0,0,0,0,,,,,,,,,,,,,,,,,,,,,,,,,,,,,,,,,,,,,,,,,,,,,,,,,,,,,,,,,,,,,,,,,,,,,,,,,,,,,,,,,,,,,,,,,,,,,,,,,,,,,,,Earth Liberation Front (ELF),20147,ELF; North American ELF ,12,24,1995,4,13,2015,12,24,1995,9,4,2009,217,51,"The Earth Liberation Front (ELF) splintered in 1992 from Earth First! (EF) when several of its members became disenchanted with EF's moderate methods. Beginning in the United Kingdom, ELF soon expanded its operations to the United States where it attracted individuals who preferred violent action to pure verbal opposition. Planning and executing attacks in a short span of time has helped ELF avoid detection throughout the years. Because the group has a leaderless resistance structure and is predominately composed of clusters of individuals who work separately, ELF has been able to maintain a certain amount of anonymity and thus avoid detection. Those members that use criminal tactics usually vandalize property or create related types of disruptions (e.g. the release of animals being utilized for medical research). With “biocentrism” as a central tenet of their philosophy, ELF has adopted methods that are not directed at killing humans. However, some environmental extremists have at times employed dangerous and potentially lethal tactics (e.g. tree spiking, arson attacks and bombings). ","The Earth Liberation Front (ELF) splintered in 1992 from Earth First! (EF) when several of its members became disenchanted with EF's moderate methods. Beginning in the United Kingdom, ELF soon expanded its operations to the United States where it attracted individuals who preferred violent action to pure verbal opposition. Planning and executing attacks in a short span of time has helped ELF avoid detection throughout the years. Because the group has a leaderless resistance structure and is predominately composed of clusters of individuals who work separately, ELF has been able to maintain a certain amount of anonymity and thus avoid detection. Those members that use criminal tactics usually vandalize property or create related types of disruptions (e.g. the release of animals being utilized for medical research). With “biocentrism” as a central tenet of their philosophy, ELF has adopted methods that are not directed at killing humans. However, some environmental extremists have at times employed dangerous and potentially lethal tactics (e.g. tree spiking, arson attacks and bombings). ",-99,-99,1992,"The Earth Liberation Front (ELF) adheres to the ideas of Arne Naess, a Norwegian philosopher, who coined his environmental perspective as “deep ecology”. The primary tenet of this philosophy is “biocentrism,” which maintains that everything in nature is of equal value and deserves protection, even inanimate objects like rocks and rivers. A blend of anarchistic, apocalyptic, millenarian thinking - uniquely dubbed “green anarchy” – along with an anti-capitalist sentiment complements their eco-centric philosophy and thus motivates ELF members to advocate violent tactics. ELF has also been influenced by Edward Abbey's book, Monkeywrenching, which has become a guidebook of sorts to environmental and animal rights extremists. Relative to other groups, ELF shares similar ideals with the Animal Liberation Front (ALF): for instance, an uncompromising position concerning the destruction of the assets of those who threaten the environment; status as a grass roots organization without any clear chain of command or any pay/benefits involved; and time and funds directed toward direct action rather than aimed at lobbying.  However, ELF, like other radical environmentalists, displays a more global, macro-level approach than ALF, and is concerned with entire species and whole ecosystems.","The Earth Liberation Front (ELF) adheres to the ideas of Arne Naess, a Norwegian philosopher, who coined his environmental perspective as “deep ecology”. The primary tenet of this philosophy is “biocentrism,” which maintains that everything in nature is of equal value and deserves protection, even inanimate objects like rocks and rivers. A blend of anarchistic, apocalyptic, millenarian thinking - uniquely dubbed “green anarchy” – along with an anti-capitalist sentiment complements their eco-centric philosophy and thus motivates ELF members to advocate violent tactics. ELF has also been influenced by Edward Abbey's book, Monkeywrenching, which has become a guidebook of sorts to environmental and animal rights extremists. Relative to other groups, ELF shares similar ideals with the Animal Liberation Front (ALF): for instance, an uncompromising position concerning the destruction of the assets of those who threaten the environment; status as a grass roots organization without any clear chain of command or any pay/benefits involved; and time and funds directed toward direct action rather than aimed at lobbying.  However, ELF, like other radical environmentalists, displays a more global, macro-level approach than ALF, and is concerned with entire species and whole ecosystems.",5,Liberation Collective of Portland; The Family (a group of organized ALF and ELF members that were responsible for a number of serious attacks); Earth First!,Animal Liberation Front; Stop Huntingdon Animal Cruelty (SHAC),0,1,1,0,0,0,0,0,0,0,0,0,0,0,,,,,,,,,,,,,,,,,,,,,,,,,,,,,,,,,,,,,,,,,,,,,,,,,,,,,,,,,,,,,,,,,,,,,,,,,,,,,,,,,,,,,,,,,,,,,,,,,,,,,,,Earth Night Action Group,10058,,4,22,1990,4,22,1990,4,22,1990,4,22,1990,-99,5,"On April 22, 1990, the Earth Night Action Group cut down power line poles owned by Pacific Gas and Electric (PG&E) in Santa Cruz, California to protest the company's hypocritical position towards protecting the environment. A letter sent by the group to a local news organization specified that PG&E is a “corporate Earth rapist” because it sponsors events in support of protecting the Earth on Earth Day, while profiting from its ownership of the hazardous nuclear power plant in Diablo Canyon. ","On April 22, 1990, the Earth Night Action Group cut down power line poles owned by Pacific Gas and Electric (PG&E) in Santa Cruz, California to protest the company's hypocritical position towards protecting the environment. A letter sent by the group to a local news organization specified that PG&E is a “corporate Earth rapist” because it sponsors events in support of protecting the Earth on Earth Day, while profiting from its ownership of the hazardous nuclear power plant in Diablo Canyon. ",-99,-99,-99,"While there is no explicit information on the group's philosophy, it is labeled in the media as an eco-terrorist group.","While there is no explicit information on the group's philosophy, it is labeled in the media as an eco-terrorist group.",5,,,-99,1,0,0,0,0,0,0,0,0,0,0,0,0,,,,,,,,,,,,,,,,,,,,,,,,,,,,,,,,,,,,,,,,,,,,,,,,,,,,,,,,,,,,,,,,,,,,,,,,,,,,,,,,,,,,,,,,,,,,,,,,,,,,,,,East Side Action Committee,4523,,11,9,1979,11,9,1979,11,9,1979,11,9,1979,-99,53,"The East Side Action Committee placed a pipe bomb inside a phone booth located within the east side of Milwaukee on November 8, 1979. A letter left with the pipe bomb specified that the group was retaliating against the U.S. hostage crisis in Iran. ","The East Side Action Committee placed a pipe bomb inside a phone booth located within the east side of Milwaukee on November 8, 1979. A letter left with the pipe bomb specified that the group was retaliating against the U.S. hostage crisis in Iran. ",-99,-99,-99,The East Side Action Committee was a single issue organization that targeted innocent U.S. civilians in retaliation for the American government's inability to resolve the U.S. hostage crisis in Iran. ,The East Side Action Committee was a single issue organization that targeted innocent U.S. civilians in retaliation for the American government's inability to resolve the U.S. hostage crisis in Iran. ,5,,,-99,0,0,0,0,0,0,0,0,0,0,0,0,1,,,,,,,,,,,,,,,,,,,,,,,,,,,,,,,,,,,,,,,,,,,,,,,,,,,,,,,,,,,,,,,,,,,,,,,,,,,,,,,,,,,,,,,,,,,,,,,,,,,,,,,Environmental Life Force,3760,Original ELF,5,1,1977,8,1,1977,5,1,1977,8,1,1977,217,5,"The Environmental Life Force (ELF) – not to be mistaken with the current Earth Liberation Front (ELF) – was founded by John Hanna in 1977 in Santa Cruz, CA. Having committed four attacks in 1977 against institutions and individuals with considerable impact on the condition of the environment, ELF was the first radical group to use violence in defense of the environment. Like many of its successors in the environmentalist movement, ELF had no central leadership and relied on the will and motivations of autonomous individuals. While ELF sought good relations with the wider public by informing and inspiring them about the harm of pesticides on the environment, the movement came under attack for its destructive action. With public pressure mounting, individuals linked to ELF ceased their activities by 1978, and the extremist elements of the environmentalist movement did not reappear until the 1979 emergence of Earth First!. ","The Environmental Life Force (ELF) – not to be mistaken with the current Earth Liberation Front (ELF) – was founded in 1977 in Santa Cruz, CA. Having committed four attacks in 1977 against institutions and individuals with considerable impact on the condition of the environment, ELF was the first radical group to use violence in defense of the environment. Like many of its successors in the environmentalist movement, ELF had no central leadership and relied on the will and motivations of autonomous individuals. While ELF sought good relations with the wider public by informing and inspiring them about the harm of pesticides on the environment, the movement came under attack for its destructive action. With public pressure mounting, individuals linked to ELF ceased their activities by 1978, and the extremist elements of the environmentalist movement did not reappear until the 1979 emergence of Earth First!. ",-99,-99,1977,"The Environmental Life Force (ELF) was part of the broader extreme environmentalist movement and used terrorist tactics as a means to both inform the public about the harmful consequences of pesticides and inspire them to action. According to John Hanna, founder of ELF, violence was used in self-defense of the Earth and was more akin to civil disobedience than terrorism. Similar to the broader environmentalist movement, ELF espoused the primary tenets of “deep ecology” and “green anarchy,” which, taken together, served as philosophical justifications for their actions.  ","The Environmental Life Force (ELF) was part of the broader extreme environmentalist movement and used terrorist tactics as a means to both inform the public about the harmful consequences of pesticides and inspire them to action. According to John Hanna, founder of ELF, violence was used in self-defense of the Earth and was more akin to civil disobedience than terrorism. Similar to the broader environmentalist movement, ELF espoused the primary tenets of “deep ecology” and “green anarchy,” which, taken together, served as philosophical justifications for their actions.  ",5,Earth First!; The Environmental Liberation Front,,-99,1,1,0,0,0,0,0,0,0,0,0,0,0,,,,,,,,,,,,,,,,,,,,,,,,,,,,,,,,,,,,,,,,,,,,,,,,,,,,,,,,,,,,,,,,,,,,,,,,,,,,,,,,,,,,,,,,,,,,,,,,,,,,,,,Evan Mecham Eco-Terrorist International Conspiracy (EMETIC),10060,EMETIC,10,5,1987,5,30,1989,10,5,1987,5,30,1989,-99,3,"Named after Evan Mecham, the former Republican governor of Arizona, the Evan Mecham Eco-Terrorist International Conspiracy (EMETIC) was an Arizona-based extreme environmentalist group that committed attacks against private resorts and government services perceived to be destroying the environment. EMETIC was an offshoot of Earth First!, a radical environmentalist group, and emerged into the public limelight in November 1987 after sabotaging ski lifts at the Fairfield Snow Bowl Ski and Summer Resort. Considered by some to be the “mother of all eco-terrorists”, EMETIC committed four terrorist attacks and was infiltrated by FBI agent Michael Fain in 1988. After an 18 month, $2 million operation, Fain collected enough intelligence to put all four EMETIC members in prison by September 1991.  ","Named after Evan Mecham, the former Republican governor of Arizona, the Evan Mecham Eco-Terrorist International Conspiracy (EMETIC) was an Arizona-based extreme environmentalist group that committed attacks against private resorts and government services perceived to be destroying the environment. EMETIC was an offshoot of Earth First!, a radical environmentalist group, and emerged into the public limelight in November 1987 after sabotaging ski lifts at the Fairfield Snow Bowl Ski and Summer Resort. Considered by some to be the “mother of all eco-terrorists”, EMETIC committed four terrorist attacks and was infiltrated by FBI agent Michael Fain in 1988. After an 18 month, $2 million operation, Fain collected enough intelligence to put all four EMETIC members in prison by September 1991.  ",11,-99,1987,"The Evan Mecham Eco-Terrorist International Conspiracy (EMETIC) stood opposed to the “spoilers of ecology” and maintained that nature deserves protection and is of equal value to human life. While most officials and scholars consider members of EMETIC to be eco-terrorists, group members perceived themselves in less insidious ways. According to one member, “We aren't really terrorists…we refuse to do anything that will physically injure anyone…we just needed a T word to make the acronym work.” [13, p.193]. EMETIC also protested the U.S. Forest Service for allowing ski resorts to commercialize natural land owned and frequented by American Indian tribes.","The Evan Mecham Eco-Terrorist International Conspiracy (EMETIC) stood opposed to the “spoilers of ecology” and maintained that nature deserves protection and is of equal value to human life. While most officials and scholars consider members of EMETIC to be eco-terrorists, group members perceived themselves in less insidious ways. According to one member, “We aren't really terrorists…we refuse to do anything that will physically injure anyone…we just needed a T word to make the acronym work.” [13, p.193]. EMETIC also protested the U.S. Forest Service for allowing ski resorts to commercialize natural land owned and frequented by American Indian tribes.",5,Earth First!,,0,1,0,0,0,0,0,0,0,0,0,0,0,0,,,,,,,,,,,,,,,,,,,,,,,,,,,,,,,,,,,,,,,,,,,,,,,,,,,,,,,,,,,,,,,,,,,,,,,,,,,,,,,,,,,,,,,,,,,,,,,,,,,,,,,