ORGNAME,INGROUP,ALIAS,GATK_FIRST_MONTH,GATK_FIRST_DAY,GATK_FIRST_YEAR,GATK_LAST_MONTH,GATK_LAST_DAY,GATK_LAST_YEAR,USATK_FIRST_MONTH,USATK_FIRST_DAY,USATK_FIRST_YEAR,USATK_LAST_MONTH,USATK_LAST_DAY,USATK_LAST_YEAR,LOC_HQ_COUNTRY_1,LOC_USATK_STATE_1,HIS ,HIS_CLEAN,DFORM_MONTH,DFORM_DAY,DFORM_YEAR,PHIL,PHIL_CLEAN,DOM_I,SPLINTER ,ALLIED  ,ORGSIZE,ENVIRONMENTAL,LEFT_WING,RIGHT_WING,RIGHT_WING_SOVEREIGN,RIGHT_WING_ANTIGOV,RELIGIOUS,RELIGIOUS_CHRISTIAN,RELIGIOUS_JEWISH,RELIGIOUS_MUSLIM,RELIGIOUS_ SHIA,RELIGIOUS_ SUNNI,NATIONALIST_SEPARATIST,SINGLE_ISSUE,,,,,,,,,,,,,,,,,,,,,,,,,,,,,,,,,,,,,,,,,,,,,,,,,,,,,,,,,,,,,,,,,,,,,,,,,,,,,,,,,,,,,,,,,,,,,,,,,,,,,,,Latin America Anti-Communist Army (LAACA),3738,Latin American Anti-Communist Army (LLAC),12,8,1974,2,5,1978,12,8,1974,2,5,1978,-99,34,"The Latin America Anti-Communist Army (LLAAC) was an anti-Castro militant group that committed attacks against Castro's interests at home and abroad, as well as attacks against the interests of countries seeking to lift economic sanctions on Cuba. The LLAC claimed responsibility for several attacks in the United States between 1974 and 1978: for instance, for instance, the LLAC bombed the entrance to the Mexican consulate in New York City in order to pressure the Mexican government to release certain Cuban exiles from prison; they committed other attacks to prevent countries form easing economic sanctions on Cuba; and they attacked the Miami-based Bahama Cruise Line, Inc. to protest the poor treatment of Cuban exile fisherman in the Bahamas. They also committed attacks - such as the bombings perpetrated by the group in December 1974 - to honor the loss of their countrymen who died fighting the Castro regime.     ","The Latin America Anti-Communist Army (LLAAC) was an anti-Castro militant group that committed attacks against Castro's interests at home and abroad, as well as attacks against the interests of countries seeking to lift economic sanctions on Cuba. The LLAC claimed responsibility for several attacks in the United States between 1974 and 1978: for instance, for instance, the LLAC bombed the entrance to the Mexican consulate in New York City in order to pressure the Mexican government to release certain Cuban exiles from prison; they committed other attacks to prevent countries form easing economic sanctions on Cuba; and they attacked the Miami-based Bahama Cruise Line, Inc. to protest the poor treatment of Cuban exile fisherman in the Bahamas. They also committed attacks - such as the bombings perpetrated by the group in December 1974 - to honor the loss of their countrymen who died fighting the Castro regime.     ",-99,-99,-99,The Anti-Communist Latin American Army was composed of Cuban exiles that harbored anti-communist and anti-Castro sentiments. ,The Anti-Communist Latin American Army was composed of Cuban exiles that harbored anti-communist and anti-Castro sentiments. ,5,,,-99,0,0,0,0,0,0,0,0,0,0,0,0,1,,,,,,,,,,,,,,,,,,,,,,,,,,,,,,,,,,,,,,,,,,,,,,,,,,,,,,,,,,,,,,,,,,,,,,,,,,,,,,,,,,,,,,,,,,,,,,,,,,,,,,,Liberation Army Fifth Battalion,20278,,2,26,1993,2,26,1993,2,26,1993,2,26,1993,-99,34,"In a letter to the New York Times received four days after the 1993 bombing of the World Trade Center in New York City, the Liberation Army Fifth Battalion claimed responsibility for the attack. The letter was sent by Nidal Ayyad, a chemical engineer from Kuwait, who was among those ultimately convicted of charges related to the bombing. The group included Ramzi Yousef, the mastermind of the World Trade Center bombing, as well as Ayyad, and several other individuals from Egypt and Jordan who were involved in the planning, preparation, and execution of the bombing. Although the group's name had not been publicly used prior to this attack, nor has it been used since, individual members of the Liberation Army Movement had numerous ties to violent actors and organizations, including Gama Islamiyah, Hamas, Palestinian Islamic Jihad, the Islamic Salvation Front, and Abu Sayyaf. They were also linked to other attacks and plots, including the 1990 assassination of Rabbi Meir Kahane, plots to attack various targets in New York City, a 1994 plot to assassinate Pope John Paul II in the Philippines, and several others.","In a letter to the New York Times received four days after the 1993 bombing of the World Trade Center in New York City, the Liberation Army Fifth Battalion claimed responsibility for the attack. The letter was sent by a chemical engineer from Kuwait, who was among those ultimately convicted of charges related to the bombing. The group included the mastermind of the World Trade Center bombing, as well as the letter-writer, and several other individuals from Egypt and Jordan who were involved in the planning, preparation, and execution of the bombing. Although the group's name had not been publicly used prior to this attack, nor has it been used since, individual members of the Liberation Army Movement had numerous ties to violent actors and organizations, including Gama Islamiyah, Hamas, Palestinian Islamic Jihad, the Islamic Salvation Front, and Abu Sayyaf. They were also linked to other attacks and plots, including the 1990 assassination of Rabbi Meir Kahane, plots to attack various targets in New York City, a 1994 plot to assassinate Pope John Paul II in the Philippines, and several others.",-99,-99,-99,"The Liberation Army Fifth Battalion was guided by the teachings of Sheikh Omar Abdel Rahman and its ideology was influenced by links to members of other groups, including secular Palestinian organizations and Salafi-Jihadi groups like al Qaida. Key member Ramzi Yousef referred to himself as a ""mujahid,"" however he claimed that the Liberation Army was not affiliated with the Muslim religion and was instead a political organization with the goal of undermining support for Israel. ","The Liberation Army Fifth Battalion was guided by the teachings of Sheikh Omar Abdel Rahman and its ideology was influenced by links to members of other groups, including secular Palestinian organizations and Salafi-Jihadi groups like al Qaida. A key member referred to himself as a ""mujahid,"" however he claimed that the Liberation Army was not affiliated with the Muslim religion and was instead a political organization with the goal of undermining support for Israel. ",3,,Al-Qaida,0,0,0,0,0,0,1,0,0,1,0,1,0,0,,,,,,,,,,,,,,,,,,,,,,,,,,,,,,,,,,,,,,,,,,,,,,,,,,,,,,,,,,,,,,,,,,,,,,,,,,,,,,,,,,,,,,,,,,,,,,,,,,,,,,,Lolita Lebron Puerto Rican Liberation Command,10027,,1,3,1977,1,3,1977,1,3,1977,1,3,1977,-99,42,"The Lolita Lebron Puerto Rican Liberation Command took its name from the leader of a group of Puerto Rican nationalists who, in March 1954, attacked the U.S. House of Representatives,  opening gun fire on members of Congress from the House gallery. Five members of Congress were injured in the attack, and Lebron and others involved in the attack were sentenced to 50 years in prison, although released after 25 years after U.S. President Jimmy Carter granted Lebron clemency. No additional information is available about the group in question.","The Lolita Lebron Puerto Rican Liberation Command took its name from the leader of a group of Puerto Rican nationalists who, in March 1954, attacked the U.S. House of Representatives,  opening gun fire on members of Congress from the House gallery. Five members of Congress were injured in the attack, and Lebron and others involved in the attack were sentenced to 50 years in prison, although released after 25 years after U.S. President Jimmy Carter granted Lebron clemency. No additional information is available about the group in question.",-99,-99,-99,No information is available on the group's philosophy.,No information is available on the group's philosophy.,4,,,-99,0,0,0,0,0,0,0,0,0,0,0,1,0,,,,,,,,,,,,,,,,,,,,,,,,,,,,,,,,,,,,,,,,,,,,,,,,,,,,,,,,,,,,,,,,,,,,,,,,,,,,,,,,,,,,,,,,,,,,,,,,,,,,,,,Luis Boitel Commandos,3762,Pedro Luis Boitel Commandos,5,25,1977,9,19,1977,5,25,1977,9,19,1977,217,10,"The Luis Boitel Commandos were a group of Cuban exiles opposed to the Fidel Castro regime in Cuba.  They conducted nine bombings over a period of about four months against targets  of other countries perceived to be friendly to the Castro regime.   Given their short operational existence, the group is believed to have consisted of militants from other groups operating under a different name.  ","The Luis Boitel Commandos were a group of Cuban exiles opposed to the Fidel Castro regime in Cuba.  They conducted nine bombings over a period of about four months against targets  of other countries perceived to be friendly to the Castro regime.   Given their short operational existence, the group is believed to have consisted of militants from other groups operating under a different name.  ",-99,-99,-99,"The Luis Boitel Commandos adhered to an anti-Castro philosophy with a focus on antagonizing US-Cuban relations and targeting businesses and other entities perceived to be friendly to the Castro regime.  The group specifically criticized the Soviet government for supporting Castro's regime, the Cuban government for its human rights violations in Cuba, the use of Cuban military forces in Africa, and the prospect of warming relations between the US and Cuba at that specific time.  Operatives often called ahead of bomb strikes, indicating intent to avoid human harm in their attacks. The group was named in honor of anti-Castro Cuban student leader who died in 1972 in a Cuban jail on the 59th day of a hunger strike.  ","The Luis Boitel Commandos adhered to an anti-Castro philosophy with a focus on antagonizing US-Cuban relations and targeting businesses and other entities perceived to be friendly to the Castro regime.  The group specifically criticized the Soviet government for supporting Castro's regime, the Cuban government for its human rights violations in Cuba, the use of Cuban military forces in Africa, and the prospect of warming relations between the US and Cuba at that specific time.  Operatives often called ahead of bomb strikes, indicating intent to avoid human harm in their attacks. The group was named in honor of anti-Castro Cuban student leader who died in 1972 in a Cuban jail on the 59th day of a hunger strike.  ",5,Coordination of United Revolutionary Organizations (CORU),"While there is strong suspicion that they were aligned with other Cuban groups under the auspices of CORU, no specific proof of alliances could be found from credible sources.",-99,0,0,0,0,0,0,0,0,0,0,0,0,1,,,,,,,,,,,,,,,,,,,,,,,,,,,,,,,,,,,,,,,,,,,,,,,,,,,,,,,,,,,,,,,,,,,,,,,,,,,,,,,,,,,,,,,,,,,,,,,,,,,,,,,M-7,3845,,7,26,1974,8,6,1974,7,26,1974,8,6,1974,-99,42,There is no available information on the group's historical context.,There is no available information on the group's historical context.,-99,-99,-99,No information is available on the group's philosophy.,No information is available on the group's philosophy.,-99,,,,0,0,0,0,0,0,0,0,0,0,0,0,0,,,,,,,,,,,,,,,,,,,,,,,,,,,,,,,,,,,,,,,,,,,,,,,,,,,,,,,,,,,,,,,,,,,,,,,,,,,,,,,,,,,,,,,,,,,,,,,,,,,,,,,Maccabee Squad and the Shield of David,10028,,1,6,1994,1,6,1994,1,6,1994,1,6,1994,-99,34,"On the morning of January 6th, 1994, the Maccabee Squad placed two firecrackers – both which initially were perceived to be proper incendiary devices – outside the headquarters of the Americans for Peace Now and the New Israel Fund. A note subsequently found at both sites stated that the “explosive devices” were placed there to protest the liberal policies of the Israel government, particularly their policy of swapping land with the Palestinians for peace. ","On the morning of January 6th, 1994, the Maccabee Squad placed two firecrackers – both which initially were perceived to be proper incendiary devices – outside the headquarters of the Americans for Peace Now and the New Israel Fund. A note subsequently found at both sites stated that the “explosive devices” were placed there to protest the liberal policies of the Israel government, particularly their policy of swapping land with the Palestinians for peace. ",-99,-99,-99,"The Maccabee Squad was a Jewish extremist group that thought Israel was on the precipice of a ""Jewish civil war,"" with themselves standing in opposition to Israel's liberal government.","The Maccabee Squad was a Jewish extremist group that thought Israel was on the precipice of a ""Jewish civil war,"" with themselves standing in opposition to Israel's liberal government.",4,,,-99,0,0,0,0,0,1,0,1,0,0,0,1,0,,,,,,,,,,,,,,,,,,,,,,,,,,,,,,,,,,,,,,,,,,,,,,,,,,,,,,,,,,,,,,,,,,,,,,,,,,,,,,,,,,,,,,,,,,,,,,,,,,,,,,,Macheteros,2371,The Boricua Popular/People's Army; Ejercito Popular Boricua; The Machete Wielders; The Cane Cutters,8,24,1978,6,24,1998,8,24,1978,6,24,1998,217,7,"Adopting their name to represent the struggle of poor Puerto Rican sugar cane farmers, the Ejercito Popular Boricua, also known as Los Macheteros (Cane Cutters or Machete Wielders), was founded on July 26, 1976, by Filiberto Ojeda Rios, Juan Enrique Segarra and Orlando Gonzalez Claudio. The Macheteros broke away from the mainstream Puerto Rico independence movement through their affirmation of the right to armed struggle for national liberation.  Members of the Macheteros believed that it was legitimate to use militant and violent means in response to the perceived injustices of the United States' illegitimate authority over Puerto Rico. More specifically, while the Macheteros' militant actions were inherently political, their activities can be categorized in three ways: (1) immediate defense actions in response to the violence of the state; (2) symbolic actions aimed at confirming the colonial conflict and affirming the right to self-determination; and (3) supply actions to obtain material resources (Gonzalez-Cruz 2005). The Macheteros were able to evade capture for so long because they maintained tight internal security, meticulously planned their attacks and executed them precisely as well.  While internal political differences between members almost ended the group in 1985, the Macheteros continued its campaign, most notably against the US Navy, throughout the 1990s. By 1999, however, members of the Macheteros made an effort to unite themselves with the broader nationalist movement. Despite losing Ojeda Rios during a gun battle with the FBI in September 2005, the Macheteros have maintain their existence into the 21st century.","Adopting their name to represent the struggle of poor Puerto Rican sugar cane farmers, the Ejercito Popular Boricua, also known as Los Macheteros (Cane Cutters or Machete Wielders), was founded on July 26, 1976. The Macheteros broke away from the mainstream Puerto Rico independence movement through their affirmation of the right to armed struggle for national liberation.  Members of the Macheteros believed that it was legitimate to use militant and violent means in response to the perceived injustices of the United States' illegitimate authority over Puerto Rico. More specifically, while the Macheteros' militant actions were inherently political, their activities can be categorized in three ways: (1) immediate defense actions in response to the violence of the state; (2) symbolic actions aimed at confirming the colonial conflict and affirming the right to self-determination; and (3) supply actions to obtain material resources (Gonzalez-Cruz 2005). The Macheteros were able to evade capture for so long because they maintained tight internal security, meticulously planned their attacks and executed them precisely as well.  While internal political differences between members almost ended the group in 1985, the Macheteros continued its campaign, most notably against the US Navy, throughout the 1990s. By 1999, however, members of the Macheteros made an effort to unite themselves with the broader nationalist movement. Despite losing a key member during a gun battle with the FBI in September 2005, the Macheteros have maintained their existence into the 21st century.",7,26,1976,"The Macheteros espouse a Marxist-Leninist political philosophy and, like most terrorist groups, are bent on attaining publicity. To achieve their social and political goals, in particular their goal of removing any American presence from Puerto Rican soil, the Macheteros maintain the legitimate use of armed struggle. According to Ojeda-Rios, leader of the Macheteros, armed struggle is legitimate because it had a defensive, selective, humanitarian and anti-colonial character. Tactically, the Macheteros maintain five positions that relate to their philosophy: (1) they reject all terrorist actions that indiscriminately affect the well being of the population; (2) they select only targets directly linked to American imperialism; (4) they position the anti-colonial armed struggle in a defensive role; and (5) all of their violent actions have to be subordinated to the political struggle of the people (Gonzalez-Cruz 2005).","The Macheteros espouse a Marxist-Leninist political philosophy and, like most terrorist groups, are bent on attaining publicity. To achieve their social and political goals, in particular their goal of removing any American presence from Puerto Rican soil, the Macheteros maintain the legitimate use of armed struggle. According to the leader of the Macheteros, armed struggle is legitimate because it had a defensive, selective, humanitarian and anti-colonial character. Tactically, the Macheteros maintain five positions that relate to their philosophy: (1) they reject all terrorist actions that indiscriminately affect the well being of the population; (2) they select only targets directly linked to American imperialism; (4) they position the anti-colonial armed struggle in a defensive role; and (5) all of their violent actions have to be subordinated to the political struggle of the people (Gonzalez-Cruz 2005).",4,Organizacion de Voluntarios de la Revolucion Puertorriquena (OVRP); People's Revolutionary Commandos (CRP),"Fuerzas Armadas de Resistencia Popular (FALN); and suspected links with:  Weather Underground (USA), some black liberation movements; Commandos Armados de Liberacion (CAL); Movimiento de Independencia Revolucionario en Armas (MIRA); Puerto Rican Nationalist Party; Partido Socialista Puertorriquena; Liga Socialista Puertorriquena; Marxist-Leninist Socialist Party of Chile; Workers World Party; Socialist Workers Party; Trotskyist Communist Fourth International; World Peace Council; Latin Kings; United Mexican-American students; Crusade for Justice; Episcopal Church Hispanic Commission; National Lawyers Guild; Weather Underground's Prairie Fire Organizing Committee; Ejercito Popular Boricua;  Organizacion de Voluntarias del Revolucion Puertorriquena; New Movement in Solidarity with Puerto Rican Independence; Resistencia Armadas Puertorriquena (RAP).",2,0,1,0,0,0,0,0,0,0,0,0,1,0,,,,,,,,,,,,,,,,,,,,,,,,,,,,,,,,,,,,,,,,,,,,,,,,,,,,,,,,,,,,,,,,,,,,,,,,,,,,,,,,,,,,,,,,,,,,,,,,,,,,,,,May 15 Organization for the Liberation of Palestine,297,15 May Organization; Organization of May 15th,1,17,1980,2,14,1984,8,11,1982,8,11,1982,95,13,"The May 15 Organization for the Liberation of Palestine was formed in 1979 as a splinter group of the Popular Front for the Liberation of Palestine - Special Operations Group.  It is named for the date that Israel came into existence and has carried out several high-profile international attacks around the world. When it disbanded in the mid-1980s, several key members joined the ""Hawari"" Special Operations Group of al Fatah.","The May 15 Organization for the Liberation of Palestine was formed in 1979 as a splinter group of the Popular Front for the Liberation of Palestine - Special Operations Group.  It is named for the date that Israel came into existence and has carried out several high-profile international attacks around the world. When it disbanded in the mid-1980s, several key members joined the ""Hawari"" Special Operations Group of al Fatah.",-99,-99,1979,The group opposed the state of Israel and sought the liberation of Palestine. Its attacks typically target Israeli or pro-Israeli entities.,The group opposed the state of Israel and sought the liberation of Palestine. Its attacks typically target Israeli or pro-Israeli entities.,4,Popular Front for the Liberation of Palestine  - Special Operations Group,,0,0,0,0,0,0,0,0,0,0,0,0,1,0,,,,,,,,,,,,,,,,,,,,,,,,,,,,,,,,,,,,,,,,,,,,,,,,,,,,,,,,,,,,,,,,,,,,,,,,,,,,,,,,,,,,,,,,,,,,,,,,,,,,,,,