ORGNAME,INGROUP,ALIAS,GATK_FIRST_MONTH,GATK_FIRST_DAY,GATK_FIRST_YEAR,GATK_LAST_MONTH,GATK_LAST_DAY,GATK_LAST_YEAR,USATK_FIRST_MONTH,USATK_FIRST_DAY,USATK_FIRST_YEAR,USATK_LAST_MONTH,USATK_LAST_DAY,USATK_LAST_YEAR,LOC_HQ_COUNTRY_1,LOC_USATK_STATE_1,HIS ,HIS_CLEAN,DFORM_MONTH,DFORM_DAY,DFORM_YEAR,PHIL,PHIL_CLEAN,DOM_I,SPLINTER ,ALLIED  ,ORGSIZE,ENVIRONMENTAL,LEFT_WING,RIGHT_WING,RIGHT_WING_SOVEREIGN,RIGHT_WING_ANTIGOV,RELIGIOUS,RELIGIOUS_CHRISTIAN,RELIGIOUS_JEWISH,RELIGIOUS_MUSLIM,RELIGIOUS_ SHIA,RELIGIOUS_ SUNNI,NATIONALIST_SEPARATIST,SINGLE_ISSUE,,,,,,,,,,,,,,,,,,,,,,,,,,,,,,,,,,,,,,,,,,,,,,,,,,,,,,,,,,,,,,,,,,,,,,,,,,,,,,,,,,,,,,,,,,,,,,,,,,,,,,,Action Squad,100047,,1,26,1980,1,26,1980,1,26,1980,1,26,1980,-99,50,"Little is known about Action Squad, which is known to be responsible for only one attack. The group, described as ""an obscure Vietnamese group,"" sent two letters to Vietnamese exile and controversial anti-communist publisher Nguyen Thanh Hoang in 1980, claiming responsibility for the firebombing of his home. The incendiary attack, which caused no casualties, was the first of several targeted attacks on Vietnamese journalists in the United States throughout the 1980s. In 1989, Hoang's name was found on a ""hit list"" including five people described as ""Vietnamese traitors... working to divide the Vietnamese expatriate community."" The list also included one person who had been killed in 1982 and another who was later killed in 1990. The list was attributed to the Vietnamese Organization to Exterminate Communists and Restore the Nation, which claimed responsibility for several of the attacks on Vietnamese journalists in the United States, suggesting a slight possibility that this group was linked to the group calling itself Action Squad. ","Little is known about Action Squad, which is known to be responsible for only one attack. The group, described as ""an obscure Vietnamese group,"" sent two letters to a Vietnamese exile and controversial anti-communist publisher in 1980, claiming responsibility for the firebombing of his home. The incendiary attack, which caused no casualties, was the first of several targeted attacks on Vietnamese journalists in the United States throughout the 1980s. In 1989, the victim's name was found on a ""hit list"" including five people described as ""Vietnamese traitors... working to divide the Vietnamese expatriate community."" The list also included one person who had been killed in 1982 and another who was later killed in 1990. The list was attributed to the Vietnamese Organization to Exterminate Communists and Restore the Nation, which claimed responsibility for several of the attacks on Vietnamese journalists in the United States, suggesting a slight possibility that this group was linked to the group calling itself Action Squad. ",-99,-99,-99,"The victim of the attack carried out by Action Squad, Nguyen Thanh Hoang, was staunchly anti-communist and claimed to have received letters stating that he ""would be punished severely if [he did] not stop [his] anticommunist policies."" However, the broader series of attacks on Vietnamese journalists in the United States targeted individuals both supportive and opposed to communism and several of the victims, including Hoang, were considered very controversial across multiple dimensions. As a result, the specific motives of the groups involved may be somewhat nuanced and it is difficult to confirm that the ideological underpinnings of Action Squad were pro-communist.","The victim of the attack carried out by Action Squad was staunchly anti-communist and claimed to have received letters stating that he ""would be punished severely if [he did] not stop [his] anticommunist policies."" However, the broader series of attacks on Vietnamese journalists in the United States targeted individuals both supportive and opposed to communism and several of the victims were considered very controversial across multiple dimensions. As a result, the specific motives of the groups involved may be somewhat nuanced and it is difficult to confirm that the ideological underpinnings of Action Squad were pro-communist.",2,, Vietnamese Organization to Exterminate Communists and Restore the Nation,-99,0,1,0,0,0,0,0,0,0,0,0,0,0,,,,,,,,,,,,,,,,,,,,,,,,,,,,,,,,,,,,,,,,,,,,,,,,,,,,,,,,,,,,,,,,,,,,,,,,,,,,,,,,,,,,,,,,,,,,,,,,,,,,,,,Al-Qaida,20029,al-Qaida; al-Qaida; The Base; Qaida al-Jihad; Islamic Army for the Liberation of Holy Places; World Islamic Front Against Jews and Crusaders; Islamic Salvation Foundation; Osama bin Laden network,12,29,1992,8,13,2011,9,11,2001,9,11,2001,4,34,"The foundation of al-Qaida began to develop when a group of Arab Muslims who traveled to Afghanistan in the 1980s to join in the jihad (holy war) against Soviet occupation.  The invasion rallied young fighters from around the world, including future founder Osama bin Laden (also, Usama bin Laden).  In 1984, bin Laden used his considerable personal wealth to assist former professor, Palestinian religious scholar, and mentor Abdullah al-Azzam in establishing a network of offices in Europe, the United States, and the Arab world known as maktab al-khadimat.  These offices, intended to recruit, train, and equip foreign fighters to participate in the conflict, served as the organizational foundation for what would become al-Qaida proper.  After the eventual withdrawal of Soviet forces from Afghanistan in 1989, bin Laden and Azzam maintained their network of an estimated 10,000-20,000 fighters under the name al-Qaida (Arabic for “the base”) for future jihad.  Al-Qaida's message to the Muslim world is generally framed in terms of a ""defensive jihad,"" in which attacks are used as a defensive measure against enemies of Islam. After the death of Azzam in 1989, bin Laden moved the base of operations from Afghanistan to Sudan to facilitate jihad against secular, pro-Western governments in the Middle East and to aid the Islamist movement in Sudan.  Though the organization's criticism of the United States strengthened after U.S. troops intervened in the Persian Gulf following the 1991 Iraqi invasion of Kuwait, al-Qaida efforts during the early 1990s remained focused on regional issues and resulted in sporadic attacks on U.S. forces in various locations including Saudi Arabia, Somalia, and Yemen.  In 1996, al-Qaida formally declared war on the United States and signaled an official shift from targeting local secular regimes and Western powers in the region (the “near enemy”) to attacking the U.S. homeland (the “far enemy”).  No longer welcome in Sudan, bin Laden shifted al-Qaida's base of operations back to Afghanistan, where he cultivated a relationship with increasingly powerful Taliban leaders.  During the late 1990s, al-Qaida strengthened its ties to other terrorist groups, built an extensive fundraising network, and successfully incorporated Ayman al-Zawahiri as its second in command.  The 1998 attacks against the U.S. embassies in Tanzania and Kenya signaled al-Qaida's first successes in attacking enemy targets in non-Muslim countries. Sources indicate that bin Laden seriously miscalculated the force with which the United States government would respond to the 9/11 terrorist attacks.  After American forces devastated the ruling Taliban in November, 2001, bin Laden and the core al-Qaida leadership were again denied safe refuge and fled to the Pakistani tribal regions.  Their influence, however, remained potent as the al Qaida core leadership endorsed and lent political, military, and financial strength to the insurgency in Iraq under Abu Musab al Zarqawi, which became known as al-Qaida in Iraq.  In May 2011, U.S. Special Forces killed Osama bin Laden in Abbottabad, Pakistan. In the weeks following bin Laden's death, al-Qaida announced Ayman al-Zawahiri as the organization's new leader, elevating him from his role as operational commander of the organization's terrorist efforts. It appears that al-Qaida will continue without bin Laden, but US officials have publically stated that they believe the organization is weakening and the group is rarely directly attributed responsibility for terrorist attacks.","The foundation of al-Qaida began to develop when a group of Arab Muslims who traveled to Afghanistan in the 1980s to join in the jihad (holy war) against Soviet occupation.  The invasion rallied young fighters from around the world.  In 1984, al-Qaida's founders established a network of offices in Europe, the United States, and the Arab world known as maktab al-khadimat.  These offices, intended to recruit, train, and equip foreign fighters to participate in the conflict, served as the organizational foundation for what would become al-Qaida proper.  After the eventual withdrawal of Soviet forces from Afghanistan in 1989, bin Laden and Azzam maintained their network of an estimated 10,000-20,000 fighters under the name al-Qaida (Arabic for “the base”) for future jihad.  Al-Qaida's message to the Muslim world is generally framed in terms of a ""defensive jihad,"" in which attacks are used as a defensive measure against enemies of Islam. In 1989, the base of operations moved from Afghanistan to Sudan to facilitate jihad against secular, pro-Western governments in the Middle East and to aid the Islamist movement in Sudan.  Though the organization's criticism of the United States strengthened after U.S. troops intervened in the Persian Gulf following the 1991 Iraqi invasion of Kuwait, al-Qaida efforts during the early 1990s remained focused on regional issues and resulted in sporadic attacks on U.S. forces in various locations including Saudi Arabia, Somalia, and Yemen.  In 1996, al-Qaida formally declared war on the United States and signaled an official shift from targeting local secular regimes and Western powers in the region (the “near enemy”) to attacking the U.S. homeland (the “far enemy”).  No longer welcome in Sudan, al-Qaida's base of operations shifted back to Afghanistan, where members cultivated a relationship with increasingly powerful Taliban leaders.  During the late 1990s, al-Qaida strengthened its ties to other terrorist groups and built an extensive fundraising network.  The 1998 attacks against the U.S. embassies in Tanzania and Kenya signaled al-Qaida's first successes in attacking enemy targets in non-Muslim countries. Sources indicate that al-Qaida leadership seriously miscalculated the force with which the United States government would respond to the 9/11 terrorist attacks.  After American forces devastated the ruling Taliban in November, 2001, the core al-Qaida leadership were again denied safe refuge and fled to the Pakistani tribal regions.  Their influence, however, remained potent as the al Qaida core leadership endorsed and lent political, military, and financial strength to the insurgency in Iraq, which became known as al-Qaida in Iraq.  In May 2011, U.S. Special Forces killed the founder and leader of al-Qaida in Abbottabad, Pakistan. In the weeks following bin Laden's death, al-Qaida announced its second-in-command as the organization's new leader, elevating him from his role as operational commander of the organization's terrorist efforts. It appears that al-Qaida will continue, but U.S. officials have publically stated that they believe the organization is weakening and the group is rarely directly attributed responsibility for terrorist attacks.",4,-99,1988,"The primary purpose of al-Qaida, and the philosophy upon which it was founded, is largely based on the perceived injustices that Muslims have suffered at the hand of the world's secular powers. The teachings and writings of renowned Egyptian thinker Sayyid Qutb played a major role in shaping the ideological context of the Islamist philosophy in the mid-to-late 20th century.  Advocating a purist form of Islam and the overthrow of the Egyptian state to impose strict Islamic rule, Qutb envisioned an Arab region united on the basis of Islamist government under the sovereignty of Allah.  This philosophy gained momentum in response to the ominous secular threat of the Soviet Union in Central Asia and Afghanistan.  The major ideological drive behind the organization originated with founder and leader Osama bin Laden, whose education and ideology were heavily influenced by Qutb's teachings.  Bin Laden's mentor and professor at King Abdul Aziz University Dr. Abdul Yusuf Azzam advocated a particularly militant brand of Qutb's purist Islam, preaching ""Jihad and the rifle alone.  No negotiation.  No meetings.  No dialogue. Jihad and the rifle alone...""    Beginning with the Soviet invasion and occupation of Afghanistan in 1979, bin Laden heavily emphasized a pan-Islamist rhetoric focused on assisting Muslims wherever they were persecuted.   These views evolved following the presence of US forces in Saudi Arabia (the home of Sunni Islam's holiest sites) during the Gulf War of 1991 to advocate attacks against all foreign influences into Muslim countries.     ","The primary purpose of al-Qaida, and the philosophy upon which it was founded, is largely based on the perceived injustices that Muslims have suffered at the hand of the world's secular powers. The teachings and writings of renowned Egyptian thinker Sayyid Qutb played a major role in shaping the ideological context of the Islamist philosophy in the mid-to-late 20th century.  Advocating a purist form of Islam and the overthrow of the Egyptian state to impose strict Islamic rule, Qutb envisioned an Arab region united on the basis of Islamist government under the sovereignty of Allah.  This philosophy gained momentum in response to the ominous secular threat of the Soviet Union in Central Asia and Afghanistan.  The major ideological drive behind the organization originated with its founder and leader, whose education and ideology were heavily influenced by Qutb's teachings.  Other influences advocated a particularly militant brand of Qutb's purist Islam, preaching ""Jihad and the rifle alone.  No negotiation.  No meetings.  No dialogue. Jihad and the rifle alone...""    Beginning with the Soviet invasion and occupation of Afghanistan in 1979, bin Laden heavily emphasized a pan-Islamist rhetoric focused on assisting Muslims wherever they were persecuted.   These views evolved following the presence of US forces in Saudi Arabia (the home of Sunni Islam's holiest sites) during the Gulf War of 1991 to advocate attacks against all foreign influences into Muslim countries.     ",3,,Egyptian Islamic Jihad; The Libyan Islamic Fighting Group; Islamic Army of Aden; Jama-at al-Tawhid wal Jihad; Lashkar-e-Taiba and Jaish-e-Muhammad (Kashmir); Islamic Movement of Uzbekistan; Armed Islamic Group; Abu Sayyaf Group; Jemaah Islamiya; Algeria's Armed Islamic Group (GIA); Al Shabaab (Somalia); Al-Qaida In the Islamic Maghreb; Al-Qaida in the Arabian Peninsula; Al-Qaida in Iraq; Taliban; Tehrik-i-Taliban Pakistan (TTP),2,0,0,0,0,0,1,0,0,1,0,1,0,0,,,,,,,,,,,,,,,,,,,,,,,,,,,,,,,,,,,,,,,,,,,,,,,,,,,,,,,,,,,,,,,,,,,,,,,,,,,,,,,,,,,,,,,,,,,,,,,,,,,,,,,Al-Qaida in the Arabian Peninsula (AQAP),20032,Al Qaida of Jihad Organization in the Arabian Peninsula; Tanzim Qaidat al-Jihad fi Jazirat al-Arab; Al-Qaida Organization in the Arabian Peninsula (AQAP); Al Qaida in the South Arabian Peninsula; Al Qaida in Yemen (AQY); Ansar al-Sharia,5,29,2004,12,25,2016,12,25,2009,12,25,2009,228,24,"The organization now known as Al Qaida in the Arabian Peninsula (AQAP) officially adopted this name in January 2009. Over the course of several years prior, AQAP emerged from a lineage of Yemeni jihadists that had been active throughout the 1990s following their return from fighting the Soviets in Afghanistan. These Yemeni jihadists were joined Saudi Arabian jihadists (also known as AQAP) that had been forced out of Saudi Arabia following defeat by security forces. In contrast to AQAP, its predecessors were more like a network of foreign and local operatives than a well-established, durable terrorist organization.  Over the course of nearly two decades, the focus and messaging of these operatives evolved from local and regional grievances to broader concerns regarding the expulsion of non-believers and Western interests from the Arabian Peninsula. Likewise, their capabilities and communications became increasingly sophisticated.","The organization now known as Al Qaida in the Arabian Peninsula (AQAP) officially adopted this name in January 2009. Over the course of several years prior, AQAP emerged from a lineage of Yemeni jihadists that had been active throughout the 1990s following their return from fighting the Soviets in Afghanistan. These Yemeni jihadists were joined Saudi Arabian jihadists (also known as AQAP) that had been forced out of Saudi Arabia following defeat by security forces. In contrast to AQAP, its predecessors were more like a network of foreign and local operatives than a well-established, durable terrorist organization.  Over the course of nearly two decades, the focus and messaging of these operatives evolved from local and regional grievances to broader concerns regarding the expulsion of non-believers and Western interests from the Arabian Peninsula. Likewise, their capabilities and communications became increasingly sophisticated.",1,23,2009,"Like al-Qaida, al Qaida in the Arabian Peninsula (AQAP) has adopted the overarching goal of replacing the concept of modern states with the creation of an Islamic caliphate. In particular, AQAP seeks to expel non-believers and implement Islamic law in the Arabian Peninsula, as well as cut off Western interests from regional oil resources. Based in Yemen, AQAP primarily carries out attacks against Yemeni targets in Yemen. However, AQAP has demonstrated its international interests by plotting and carrying out numerous attacks against foreign targets. With few exceptions, these attacks take place primarily in Yemen, and to a lesser extent Saudi Arabia, indicating that AQAP's operational capabilities abroad are limited. AQAP has also prioritized developing its media capabilities, including the use of online propaganda and English-language publications encouraging and instructing individuals to take up the cause of leaderless jihad in the West.","Like al-Qaida, al Qaida in the Arabian Peninsula (AQAP) has adopted the overarching goal of replacing the concept of modern states with the creation of an Islamic caliphate. In particular, AQAP seeks to expel non-believers and implement Islamic law in the Arabian Peninsula, as well as cut off Western interests from regional oil resources. Based in Yemen, AQAP primarily carries out attacks against Yemeni targets in Yemen. However, AQAP has demonstrated its international interests by plotting and carrying out numerous attacks against foreign targets. With few exceptions, these attacks take place primarily in Yemen, and to a lesser extent Saudi Arabia, indicating that AQAP's operational capabilities abroad are limited. AQAP has also prioritized developing its media capabilities, including the use of online propaganda and English-language publications encouraging and instructing individuals to take up the cause of leaderless jihad in the West.",3,Al Qaida in Saudi Arabia; Al Qaida in Yemen,Al Qaida; Al Shabaab; Al Qaida in the Islamic Maghreb; ,2,0,0,0,0,0,1,0,0,1,0,1,0,0,,,,,,,,,,,,,,,,,,,,,,,,,,,,,,,,,,,,,,,,,,,,,,,,,,,,,,,,,,,,,,,,,,,,,,,,,,,,,,,,,,,,,,,,,,,,,,,,,,,,,,,American Indian Movement,10000,AIM,2,27,1973,10,13,1975,2,27,1973,10,13,1975,-99,45,"The American Indian Movement (AIM) was founded in 1968 after Dennis Banks, Clyde Belleocourt and George Mitchell hosted a meeting in Minneapolis, Minnesota, to discuss injustices that Native Americans were experiencing in the United States. Members from Indian tribes around the country, as well as sympathizers, were motivated to join AIM at a time when a new “pan-Indian identity” fueled the growth of several Indian activist groups in the United States.  More specifically, the AIM pressured the U.S. government through several modes of non-violent activities (e.g., political demonstrations that took place at Mt. Rushmore and Plymouth Rock) to uphold their agreements as codified in longstanding treaties. In addition, the AIM protested against “high unemployment, slum housing, and racist treatment; fought for…the reclamation of tribal lands; and advocated on behalf of urban Indians whose situation bred illness and poverty.” According to AIM member Carter Camp, the AIM was a relatively peaceful movement until “violence was needed in order to wake the people up” [5]. The movement utilized violent tactics that members learned during their engagements with several allied groups – for instance, the Popular Front for the Liberation of Palestine, the Weathermen Underground, Symbionese Liberation Army, the Irish Republican Army and the New World Liberation Front - and guerilla training operations with the Sandinistas and the Palestinian Liberation Organization [6]. By the late 1970s, the CIA and FBI had infiltrated the AIM and arrested several of the movement's most radical members. The AIM continues to exist as of 2013, maintaining a comprehensive website that continues to advocate for the social, political and economic betterment of the native Indian condition. ","The American Indian Movement (AIM) was founded in 1968 after three individuals hosted a meeting in Minneapolis, Minnesota, to discuss injustices that Native Americans were experiencing in the United States. Members from Indian tribes around the country, as well as sympathizers, were motivated to join AIM at a time when a new “pan-Indian identity” fueled the growth of several Indian activist groups in the United States.  More specifically, the AIM pressured the U.S. government through several modes of non-violent activities (e.g., political demonstrations that took place at Mt. Rushmore and Plymouth Rock) to uphold their agreements as codified in longstanding treaties. In addition, the AIM protested against “high unemployment, slum housing, and racist treatment; fought for…the reclamation of tribal lands; and advocated on behalf of urban Indians whose situation bred illness and poverty.” According to an AIM member, the AIM was a relatively peaceful movement until “violence was needed in order to wake the people up” [5]. The movement utilized violent tactics that members learned during their engagements with several allied groups – for instance, the Popular Front for the Liberation of Palestine, the Weathermen Underground, Symbionese Liberation Army, the Irish Republican Army and the New World Liberation Front - and guerilla training operations with the Sandinistas and the Palestinian Liberation Organization [6]. By the late 1970s, the CIA and FBI had infiltrated the AIM and arrested several of the movement's most radical members. The AIM continues to exist as of 2013, maintaining a comprehensive website that continues to advocate for the social, political and economic betterment of the native Indian condition. ",-99,-99,1968,"The American Indian Movement's (AIM) philosophy is centered on preserving Indian territory acquired through treaties with the U.S. government and improving the condition of Indian communities throughout the United States. According to an AIM documentary, entitled “We Shall Remain,” one of the main objectives of the movement is to return a sense of culture, or Indian-ness, to all native Indians. The AIM's philosophy is also defensive in nature: according to Russell Means, a leading member of the movement, “We were about to be obliterated culturally…our spiritual way of life – our entire way of life was about to be stamped out and this [movement] was a rebirth of our dignity and self-pride” [7].  ","The American Indian Movement's (AIM) philosophy is centered on preserving Indian territory acquired through treaties with the U.S. government and improving the condition of Indian communities throughout the United States. According to an AIM documentary, entitled “We Shall Remain,” one of the main objectives of the movement is to return a sense of culture, or Indian-ness, to all native Indians. The AIM's philosophy is also defensive in nature: according to a leading member of the movement, “We were about to be obliterated culturally…our spiritual way of life – our entire way of life was about to be stamped out and this [movement] was a rebirth of our dignity and self-pride” [7].  ",4,,Popular Front for the Liberation of Palestine; Weather Underground Organization; Symbionese Liberation Army (SLA); Irish Republican Army; New World Liberation Front; Iranian Students Union,-99,0,0,0,0,0,0,0,0,0,0,0,1,0,,,,,,,,,,,,,,,,,,,,,,,,,,,,,,,,,,,,,,,,,,,,,,,,,,,,,,,,,,,,,,,,,,,,,,,,,,,,,,,,,,,,,,,,,,,,,,,,,,,,,,,American Servicemen's Union (ASU),100046,ASU,7,26,1970,7,26,1970,7,26,1970,7,26,1970,-99,50,The American Servicemen's Union was the first organized GI union and was established in 1967 as a Marxist/Anti-War group.  The group was formed to protest the Vietnam War and to represent the interests of GIs.,The American Servicemen's Union was the first organized GI union and was established in 1967 as a Marxist/Anti-War group.  The group was formed to protest the Vietnam War and to represent the interests of GIs.,-99,-99,1967,"The founder of the group, Pvt. Andy Stapp, was well known for being an anti-war advocate and a Marxist.  Beyond this, no other information the philosophy of the group.","The founder of the group was well known for being an anti-war advocate and a Marxist.  Beyond this, no other information the philosophy of the group.",2,,,-99,0,1,0,0,0,0,0,0,0,0,0,0,0,,,,,,,,,,,,,,,,,,,,,,,,,,,,,,,,,,,,,,,,,,,,,,,,,,,,,,,,,,,,,,,,,,,,,,,,,,,,,,,,,,,,,,,,,,,,,,,,,,,,,,,