ORGNAME,INGROUP,ALIAS,GATK_FIRST_MONTH,GATK_FIRST_DAY,GATK_FIRST_YEAR,GATK_LAST_MONTH,GATK_LAST_DAY,GATK_LAST_YEAR,USATK_FIRST_MONTH,USATK_FIRST_DAY,USATK_FIRST_YEAR,USATK_LAST_MONTH,USATK_LAST_DAY,USATK_LAST_YEAR,LOC_HQ_COUNTRY_1,LOC_USATK_STATE_1,HIS ,HIS_CLEAN,DFORM_MONTH,DFORM_DAY,DFORM_YEAR,PHIL,PHIL_CLEAN,DOM_I,SPLINTER ,ALLIED  ,ORGSIZE,ENVIRONMENTAL,LEFT_WING,RIGHT_WING,RIGHT_WING_SOVEREIGN,RIGHT_WING_ANTIGOV,RELIGIOUS,RELIGIOUS_CHRISTIAN,RELIGIOUS_JEWISH,RELIGIOUS_MUSLIM,RELIGIOUS_ SHIA,RELIGIOUS_ SUNNI,NATIONALIST_SEPARATIST,SINGLE_ISSUE,,,,,,,,,,,,,,,,,,,,,,,,,,,,,,,,,,,,,,,,,,,,,,,,,,,,,,,,,,,,,,,,,,,,,,,,,,,,,,,,,,,,,,,,,,,,,,,,,,,,,,,Puerto Rican Armed Resistance,2876,Puerto Rican Armed Resistance Movement; Movimiento de Resistencia Armada Puertorriquena,12,21,1980,5,21,1981,12,21,1980,5,21,1981,217,34,"The Puerto Rican Armed Resistance (PRAR) was an obscure independence group that executed several bombings in New York City from late 1980 through May 1981.  On December 21, 1980, a pair of pipe bombs exploded in a public locker at Penn Station, causing significant damage but no injuries.  The group's only lethal attack occurred on May 16, 1981, when a bomb exploded in a men's room at Kennedy Airport killing employee Alex McMillan. This attack started a five-day stint of bombings against targets including the Honduran consulate and three United Nations targets.  There is some degree of disagreement amongst experts as to whether the group is an offshoot of the infamous Armed Forces for National Liberation (FALN), but the group mimicked the FALN modus operandi and operated under essentially the same ideology.    ","The Puerto Rican Armed Resistance (PRAR) was an obscure independence group that executed several bombings in New York City from late 1980 through May 1981.  On December 21, 1980, a pair of pipe bombs exploded in a public locker at Penn Station, causing significant damage but no injuries.  The group's only lethal attack occurred on May 16, 1981, when a bomb exploded in a men's room at Kennedy Airport killing employee Alex McMillan. This attack started a five-day stint of bombings against targets including the Honduran consulate and three United Nations targets.  There is some degree of disagreement amongst experts as to whether the group is an offshoot of the infamous Armed Forces for National Liberation (FALN), but the group mimicked the FALN modus operandi and operated under essentially the same ideology.    ",-99,-99,-99,"The PRAR was part of the Puerto Rican nationalist movement and advocated independence from the United States.  In a call to the United Press International following the Penn Station bombing, the PRAR claimed the bombing was “in retaliation for crimes against Puerto Rican nationalists in Puerto Rico.”  Additional calls protested imprisoned Puerto Ricans in Chicago and claimed that President Reagan oppressed “all people.”  Like other Puerto Rican separatist groups, the Puerto Rican Armed Resistance sought to draw attention to the perceived  colonial status  of the island and gain support for the expulsion of the United States from Puerto Rican territory. While explicit declarations of their philosophical basis are unclear, analysts believe that the broader Puerto Rican independence movement largely adhered to a Marxist-Leninist ideology.","The PRAR was part of the Puerto Rican nationalist movement and advocated independence from the United States.  In a call to the United Press International following the Penn Station bombing, the PRAR claimed the bombing was “in retaliation for crimes against Puerto Rican nationalists in Puerto Rico.”  Additional calls protested imprisoned Puerto Ricans in Chicago and claimed that President Reagan oppressed “all people.”  Like other Puerto Rican separatist groups, the Puerto Rican Armed Resistance sought to draw attention to the perceived  colonial status  of the island and gain support for the expulsion of the United States from Puerto Rican territory. While explicit declarations of their philosophical basis are unclear, analysts believe that the broader Puerto Rican independence movement largely adhered to a Marxist-Leninist ideology.",4,Fuerzas Armadas de Liberacion Nacional (FALN) ,,-99,0,1,0,0,0,0,0,0,0,0,0,1,0,,,,,,,,,,,,,,,,,,,,,,,,,,,,,,,,,,,,,,,,,,,,,,,,,,,,,,,,,,,,,,,,,,,,,,,,,,,,,,,,,,,,,,,,,,,,,,,,,,,,,,,Puerto Rican Liberation Front,4879,,11,22,1971,12,22,1971,11,22,1971,12,22,1971,217,32,"The Puerto Rican Liberation Front was an obscure group that attacked two targets in Camden, New Jersey in 1971.  ","The Puerto Rican Liberation Front was an obscure group that attacked two targets in Camden, New Jersey in 1971.  ",-99,-99,-99,"Very little is known about the philosophy of the Puerto Rican Liberation front.  Certain characteristics, however, can be gleaned from the nature of the group's attacks in the historical context of the broader Puerto Rican independence movement.  It is likely that the group was a militant, pro-independence group that sought the end of US influence in Puerto Rico. When Puerto Rican nationalist groups operated in the U.S., they tended to attack private industry like banks and corporations.  Ideologically, most groups of in this movement adhered to a leftist platform based on communist or socialist principles of a workers' revolution.   ","Very little is known about the philosophy of the Puerto Rican Liberation front.  Certain characteristics, however, can be gleaned from the nature of the group's attacks in the historical context of the broader Puerto Rican independence movement.  It is likely that the group was a militant, pro-independence group that sought the end of US influence in Puerto Rico. When Puerto Rican nationalist groups operated in the U.S., they tended to attack private industry like banks and corporations.  Ideologically, most groups of in this movement adhered to a leftist platform based on communist or socialist principles of a workers' revolution.   ",4,,,-99,0,0,0,0,0,0,0,0,0,0,0,1,0,,,,,,,,,,,,,,,,,,,,,,,,,,,,,,,,,,,,,,,,,,,,,,,,,,,,,,,,,,,,,,,,,,,,,,,,,,,,,,,,,,,,,,,,,,,,,,,,,,,,,,,Puerto Rican Resistance Movement,3959, ,3,21,1970,3,1,1971,3,21,1970,3,1,1971,-99,34,"The Puerto Rican Resistance Movement claimed responsibility for igniting incendiary devices at both Alexander's department store and Bloomingdale's in March 1970, and bombing New York's New School for Social Research in March 1971. In general, the attacks were politically motivated and meant to pressure the United States to give independence to Puerto Rico. More specifically, the attack on the New School was to protest the school's alleged attempt “to destroy the Puerto Rican nationality” by promoting the use of “Spanglish” [2].","The Puerto Rican Resistance Movement claimed responsibility for igniting incendiary devices at both Alexander's department store and Bloomingdale's in March 1970, and bombing New York's New School for Social Research in March 1971. In general, the attacks were politically motivated and meant to pressure the United States to give independence to Puerto Rico. More specifically, the attack on the New School was to protest the school's alleged attempt “to destroy the Puerto Rican nationality” by promoting the use of “Spanglish” [2].",-99,-99,-99,"While there is no explicit ideology stated, media sources labled the group as an idependence group.","While there is no explicit ideology stated, media sources labled the group as an idependence group.",4,,,-99,0,0,0,0,0,0,0,0,0,0,0,1,0,,,,,,,,,,,,,,,,,,,,,,,,,,,,,,,,,,,,,,,,,,,,,,,,,,,,,,,,,,,,,,,,,,,,,,,,,,,,,,,,,,,,,,,,,,,,,,,,,,,,,,,Puerto Rican Revolutionary Movement,10037,,8,17,1972,8,18,1972,8,17,1972,8,18,1972,-99,34,The Puerto Rican Revolutionary Movement was attributed with responsibility for setting minor fires at five different department stores in New York City in mid-March 1972. The attacks were meant to pressure the United States into giving Puerto Rico independence. ,The Puerto Rican Revolutionary Movement was attributed with responsibility for setting minor fires at five different department stores in New York City in mid-March 1972. The attacks were meant to pressure the United States into giving Puerto Rico independence. ,-99,-99,-99,"While there is no explicit ideology stated, media sources labled the group as an independence group.","While there is no explicit ideology stated, media sources labled the group as an independence group.",4,,Cuban groups (seen protesting with the Revolutionary movement outside the UN).,-99,0,0,0,0,0,0,0,0,0,0,0,1,0,,,,,,,,,,,,,,,,,,,,,,,,,,,,,,,,,,,,,,,,,,,,,,,,,,,,,,,,,,,,,,,,,,,,,,,,,,,,,,,,,,,,,,,,,,,,,,,,,,,,,,,Quartermoon Society,3952,,10,8,1970,9,24,1971,10,8,1970,9,24,1971,-99,51,"The Quartermoon Society (QS) bombed two US military targets – one, a Navy ROTC and the other, an Army recruiting station – in Washington State between 1970 and 1971. Because the Navy ROTC bombing was allegedly committed in remembrance of Diana Oughton, a former member of the Weathermen who died in the Greenwich Village explosion, it is suspected that QS had membership ties with the Students for a Democratic Society and Weather Underground Organization.","The Quartermoon Society (QS) bombed two US military targets – one, a Navy ROTC and the other, an Army recruiting station – in Washington State between 1970 and 1971. Because the Navy ROTC bombing was allegedly committed in remembrance of a former member of the Weathermen who died in the Greenwich Village explosion, it is suspected that QS had membership ties with the Students for a Democratic Society and Weather Underground Organization.",-99,-99,-99,The Quartermoon Society (QS) was a revolutionary leftist organization that had suspected ties to the Weather Underground Organization. ,The Quartermoon Society (QS) was a revolutionary leftist organization that had suspected ties to the Weather Underground Organization. ,2,,Weatherman Underground,-99,0,1,0,0,0,0,0,0,0,0,0,0,0,,,,,,,,,,,,,,,,,,,,,,,,,,,,,,,,,,,,,,,,,,,,,,,,,,,,,,,,,,,,,,,,,,,,,,,,,,,,,,,,,,,,,,,,,,,,,,,,,,,,,,,Rajneeshees,5288,Neo-Sannyasins; Orange People,7,15,1984,9,20,1984,7,15,1984,9,20,1984,217,39,"The Rajneeshees, a religious cult of followers that subscribed to the Indian philosophy professor Bhagwan Shree Rajneesh, were responsible for one of the most severe bioterrorism attacks in history. The group settled on a commune outside a tiny town in Wasco County, Oregon, and quickly grew to 4,000 members- about 100 times larger than the population of the outlying town.  Attempts to further expand their commune were blocked by local governments, leading to tensions between the Rajneeshees and the town leadership.  This led to their most famous attack in 1984, when the Rajneeshees contaminated multiple food sources with salmonella typhimurium (commonly known as salmonella), causing 751 residents to become violently ill over the following weeks.  Authorities later deemed the attack a plot to incapacitate opposition voters and allow Rajneeshee representatives to take control of the county government. In the following years, other Rajneeshee leaders were connected to poisoning attacks against Wasco County officials, arson, attempted murder, immigration fraud, and other crimes, and were ultimately jailed.  Rajneesh was later arrested on immigration fraud charges and subsequently deported, which effectively leading to the group's dissolution.   ","The Rajneeshees, a religious cult of followers that subscribed to the Indian philosophy professor Bhagwan Shree Rajneesh, were responsible for one of the most severe bioterrorism attacks in history. The group settled on a commune outside a tiny town in Wasco County, Oregon, and quickly grew to 4,000 members- about 100 times larger than the population of the outlying town.  Attempts to further expand their commune were blocked by local governments, leading to tensions between the Rajneeshees and the town leadership.  This led to their most famous attack in 1984, when the Rajneeshees contaminated multiple food sources with salmonella typhimurium (commonly known as salmonella), causing 751 residents to become violently ill over the following weeks.  Authorities later deemed the attack a plot to incapacitate opposition voters and allow Rajneeshee representatives to take control of the county government. In the following years, other Rajneeshee leaders were connected to poisoning attacks against Wasco County officials, arson, attempted murder, immigration fraud, and other crimes, and were ultimately jailed.  Rajneesh was later arrested on immigration fraud charges and subsequently deported, which effectively leading to the group's dissolution.   ",-99,-99,1981,"The Rajneeshee philosophy was essentially based on the teachings of leader Bhagwan Shree Rajneesh.  The philosophy, rooted in a mixture of meditation, individualism, communal living, and a Rajneeshee religion, was rather convoluted, often self-contradictory, and generally irrelevant to the reasons for committing the bioterrorism attacks.  From that perspective, the group's motivations for conducting the attacks stemmed from general friction between Rajneeshees and local residents opposed to their expansion.  Ma Anand Sheela, who was the driving force behind the salmonella attacks, believed the attacks would incapacitate sufficient numbers of voters to enable Rajneeshees to occupy influential voting positions in the county government. ","The Rajneeshee philosophy was essentially based on the teachings of leader Bhagwan Shree Rajneesh.  The philosophy, rooted in a mixture of meditation, individualism, communal living, and a Rajneeshee religion, was rather convoluted, often self-contradictory, and generally irrelevant to the reasons for committing the bioterrorism attacks.  From that perspective, the group's motivations for conducting the attacks stemmed from general friction between Rajneeshees and local residents opposed to their expansion.   The person who was the driving force behind the salmonella attacks believed the attacks would incapacitate sufficient numbers of voters to enable Rajneeshees to occupy influential voting positions in the county government. ",3,,,2,0,0,0,0,0,1,0,0,0,0,0,0,0,,,,,,,,,,,,,,,,,,,,,,,,,,,,,,,,,,,,,,,,,,,,,,,,,,,,,,,,,,,,,,,,,,,,,,,,,,,,,,,,,,,,,,,,,,,,,,,,,,,,,,,Red Guerilla Family,3853,,3,27,1975,3,5,1976,3,27,1975,3,5,1976,217,5,The Red Guerilla Family (RGF) was a revolutionary Marxist-Leninist group that operated in the mid-1970s in the San Francisco Bay area.  Little is known about the internal operation of the RGF other than their purported solidarity with other leftist organizations in the area. The group conducted several bombings against business and government targets during this time and most likely splintered from Weather Underground Organization.,The Red Guerilla Family (RGF) was a revolutionary Marxist-Leninist group that operated in the mid-1970s in the San Francisco Bay area.  Little is known about the internal operation of the RGF other than their purported solidarity with other leftist organizations in the area. The group conducted several bombings against business and government targets during this time and most likely splintered from Weather Underground Organization.,-99,-99,-99,"The Red Guerilla Family adhered to a Marxist-Leninist philosophy based on the denouncement of perceived oppression from the American capitalist state and issued communiqués in solidarity with other leftist revolutionaries like the Symbionese Liberation Army.   In a prominent post-attack communiqué,  RGF explained its rationale for targeting an office of the Union Carbide corporation in San Francisco.  RGF asserted that the firm, which dealt in heavy metal mining in Zimbabwe, South Africa, and other developing nations, was guilty of propping up repressive and racist regimes in those countries and supporting the US military during the Vietnam War.  The message ended by railing against the “super rich ruling class” of America and stating solidarity with the peoples of those African nations.  ","The Red Guerilla Family adhered to a Marxist-Leninist philosophy based on the denouncement of perceived oppression from the American capitalist state and issued communiqués in solidarity with other leftist revolutionaries like the Symbionese Liberation Army.   In a prominent post-attack communiqué,  RGF explained its rationale for targeting an office of the Union Carbide corporation in San Francisco.  RGF asserted that the firm, which dealt in heavy metal mining in Zimbabwe, South Africa, and other developing nations, was guilty of propping up repressive and racist regimes in those countries and supporting the US military during the Vietnam War.  The message ended by railing against the “super rich ruling class” of America and stating solidarity with the peoples of those African nations.  ",2,Weathermen; New World Liberation Front,Symbionese Liberation Army ,-99,0,1,0,0,0,0,0,0,0,0,0,0,0,,,,,,,,,,,,,,,,,,,,,,,,,,,,,,,,,,,,,,,,,,,,,,,,,,,,,,,,,,,,,,,,,,,,,,,,,,,,,,,,,,,,,,,,,,,,,,,,,,,,,,,Regulators,3933,,5,9,1971,5,9,1971,5,9,1971,5,9,1971,-99,35,The Regulators claimed responsibility for the attempted bombing of the home of the president of North Carolina A&T State University on May 9. 1971. ,The Regulators claimed responsibility for the attempted bombing of the home of the president of North Carolina A&T State University on May 9. 1971. ,-99,-99,-99,No information is available on the group's philosophy.,No information is available on the group's philosophy.,-99,,,-99,0,0,0,0,0,0,0,0,0,0,0,0,0,,,,,,,,,,,,,,,,,,,,,,,,,,,,,,,,,,,,,,,,,,,,,,,,,,,,,,,,,,,,,,,,,,,,,,,,,,,,,,,,,,,,,,,,,,,,,,,,,,,,,,,Republic of New Afrika,5317,New Afrika (NA),12,31,1972,1,7,1973,12,31,1972,1,7,1973,217,20,"The Republic of New Africa (RNA) was formed in 1968 by brothers Milton and Richard Henry in Detroit, Michigan, and consisted of several members from the Black Panther Party and Black Liberation Army. The RNA emerged as a black separatist movement devoted to enhancing the rights of African Americans in the United States; building a black nation-state out of the southern territory (Alabama, Georgia, Louisiana, Mississippi and South Carolina) of the U.S.; and obtaining financial reparations from the U.S. government for past offenses (e.g. slavery) against African Americans. The RNA earned the support of Black communities and was popular amongst Black university students throughout the US, particularly at Tougaloo College in Mississippi. Towards achieving its goals, the RNA's leadership worked the American legal and political process and established a working government to legitimize its perceived right to statehood. Beyond this, the military arm of the RNA, known as New African Freedom Fighters, used violent and non-violent illegal activities to support the movement. For instance, to help finance the movement, members of the RNA colluded with members of the BLA, May 19th Organization and Weather Underground during the 1981 Brink's armored truck robbery. And although the RNA denied its ties to acts of terrorism, three members of the movement were implicated in a 1971 airplane hijacking. Perceived as a threat to the US, the RNA was often targeted and infiltrated by agents from the Federal Bureau of Investigation and local law enforcement agencies. That several members of the RNA, including its president, Imari Obadele (formally known as Richard Henry), were arrested made it difficult for the movement to sustain momentum.  Currently the movement is defunct; yet, as of 2002, some sources suggest that remnants of the RNA continue to promote awareness of racial injustice in America.  ","The Republic of New Africa (RNA) was formed in 1968 by two brothers in Detroit, Michigan, and consisted of several members from the Black Panther Party and Black Liberation Army. The RNA emerged as a black separatist movement devoted to enhancing the rights of African Americans in the United States; building a black nation-state out of the southern territory (Alabama, Georgia, Louisiana, Mississippi and South Carolina) of the U.S.; and obtaining financial reparations from the U.S. government for past offenses (e.g. slavery) against African Americans. The RNA earned the support of Black communities and was popular amongst Black university students throughout the US, particularly at Tougaloo College in Mississippi. Towards achieving its goals, the RNA's leadership worked the American legal and political process and established a working government to legitimize its perceived right to statehood. Beyond this, the military arm of the RNA, known as New African Freedom Fighters, used violent and non-violent illegal activities to support the movement. For instance, to help finance the movement, members of the RNA colluded with members of the BLA, May 19th Organization and Weather Underground during the 1981 Brink's armored truck robbery. And although the RNA denied its ties to acts of terrorism, three members of the movement were implicated in a 1971 airplane hijacking. Perceived as a threat to the US, the RNA was often targeted and infiltrated by agents from the Federal Bureau of Investigation and local law enforcement agencies. That several members of the RNA, including its president, were arrested made it difficult for the movement to sustain momentum.  Currently, the movement is defunct; yet, as of 2002, some sources suggest that remnants of the RNA continue to promote awareness of racial injustice in America.",3,31,1968,"The Republic of New Africa (RNA) was part of the broader Black Nationalist movement in the United States and was devoted to achieving territorial separatism and financial reparations for all African Americans based on past injuries. Drawing on Puerto Rico's legal right to a referendum (1967), the RNA claimed a right to self-determination based on the perception that Blacks and Whites will never share mutual social and political equality in society. Once their self-determination was actualized, the RNA wanted to build “New Africa” according to the Ujamaa system, a Tanzanian socio-political system that “focused on cooperative economics and community self-sufficiency” [Source 7, pg. 71]. Both the RNA's 15 point national creed and Declaration of Independence reference the republic's commitment to cherishing all religions; maintaining gender and racial equality; cherishing the community over the individual; rewarding hard work; and ending all forms of exploitation. With a socialist system in place, the republic would provide all of its citizens with five essentials for human life: food, housing, clothing, medical treatment and defense [Source 10, para. 2].","The Republic of New Africa (RNA) was part of the broader Black Nationalist movement in the United States and was devoted to achieving territorial separatism and financial reparations for all African Americans based on past injuries. Drawing on Puerto Rico's legal right to a referendum (1967), the RNA claimed a right to self-determination based on the perception that Blacks and Whites will never share mutual social and political equality in society. Once their self-determination was actualized, the RNA wanted to build “New Africa” according to the Ujamaa system, a Tanzanian socio-political system that “focused on cooperative economics and community self-sufficiency” [Source 7, pg. 71]. Both the RNA's 15 point national creed and Declaration of Independence reference the republic's commitment to cherishing all religions; maintaining gender and racial equality; cherishing the community over the individual; rewarding hard work; and ending all forms of exploitation. With a socialist system in place, the republic would provide all of its citizens with five essentials for human life: food, housing, clothing, medical treatment and defense [Source 10, para. 2].",4, New Afrikan Freedom Fighters (NAFF; military wing of RNA); New Afrikan People's Organization,FALN; the Weather Underground; May 19th Communist Organization (M-19); Black Liberation Army,0,0,1,0,0,0,0,0,0,0,0,0,1,0,,,,,,,,,,,,,,,,,,,,,,,,,,,,,,,,,,,,,,,,,,,,,,,,,,,,,,,,,,,,,,,,,,,,,,,,,,,,,,,,,,,,,,,,,,,,,,,,,,,,,,,